Title,Authors,Published,Year,URL,Summary
Automated discovery and optimization of autonomous quantum error correction codes for a general open quantum system,Sahel Ashhab,2025-04-21,2025,http://arxiv.org/abs/2504.15070v1,"We develop a method to search for the optimal code space, induced decay rates and control Hamiltonian to implement autonomous quantum error correction (AQEC) for a general open quantum system. The system is defined by a free-evolution Lindbladian superoperator, which contains the free Hamiltonian and naturally occurring decoherence terms, as well as the control superoperators. The performance metric for optimization is the fidelity between the projector onto the code space and the same projector after Lindbladian evolution for a specified time. We use a gradient-based search to update the code words, induced decay matrix and control Hamiltonian matrix. We apply the method to optimize AQEC codes for a variety of few-level systems. The four-level system with uniform decay rates offers a simple example for testing and illustrating the operation of our approach. The algorithm reliably succeeds in finding the optimal code in this case, while success becomes probabilistic for more complicated cases. For a five-level system with photon loss decay, the algorithm finds good AQEC codes, but these codes are not as good as the well-known binomial code. We use the binomial code as a starting point to search for the optimal code for a perturbed five-level system. In this case, the algorithm finds a code that is better than both the original binomial code and any other code obtained numerically when starting from a random initial guess."
Failure of the comformal-map method for relativistic quantum billiards,Barbara Dietz,2025-04-21,2025,http://arxiv.org/abs/2504.15055v1,"We demonstrate that the conformal-map method introduced by Robnik in 1984 for nonrelativistic quantum billiards is not applicable for the quantization of relativistic neutrino billiards (NBs) consisting of a massless non-interacting spin-1/2 particle confined to a two-dimensional domain. To be precise, we demonstrate in this work, that this method does not provide solutions of the associated Weyl (Dirac) equation, nor does it fulfill the boundary conditions imposed on the spinor eigenfunctions to ensure confinement of the particle to the domain of the billiard. We review in detail the wave equation, boundary conditions and quantization of NBs and derivation of relevant equations, to make the proof comprehensible for the general reader. Our results are corroborated with numerical results for non-relativistic and relativistic quantum billiards whose shapes depend on a parameter, which allows the study of the properties of their eigenstates as the classical dynamics experiences a transition from regular to chaotic dynamics."
Quantum pseudoresources imply cryptography,"Alex B. Grilo, Álvaro Yángüez",2025-04-21,2025,http://arxiv.org/abs/2504.15025v1,"While one-way functions (OWFs) serve as the minimal assumption for computational cryptography in the classical setting, in quantum cryptography, we have even weaker cryptographic assumptions such as pseudo-random states, and EFI pairs, among others. Moreover, the minimal assumption for computational quantum cryptography remains an open question. Recently, it has been shown that pseudoentanglement is necessary for the existence of quantum cryptography (Goul\~ao and Elkouss 2024), but no cryptographic construction has been built from it.   In this work, we study the cryptographic usefulness of quantum pseudoresources -- a pair of families of quantum states that exhibit a gap in their resource content yet remain computationally indistinguishable. We show that quantum pseudoresources imply a variant of EFI pairs, which we call EPFI pairs, and that these are equivalent to quantum commitments and thus EFI pairs. Our results suggest that, just as randomness is fundamental to classical cryptography, quantum resources may play a similarly crucial role in the quantum setting.   Finally, we focus on the specific case of entanglement, analyzing different definitions of pseudoentanglement and their implications for constructing EPFI pairs. Moreover, we propose a new cryptographic functionality that is intrinsically dependent on entanglement as a resource."
Trainable Quantum Neural Network for Multiclass Image Classification with the Power of Pre-trained Tree Tensor Networks,"Keisuke Murota, Takumi Kobori",2025-04-21,2025,http://arxiv.org/abs/2504.14995v1,"Tree tensor networks (TTNs) offer powerful models for image classification. While these TTN image classifiers already show excellent performance on classical hardware, embedding them into quantum neural networks (QNNs) may further improve the performance by leveraging quantum resources. However, embedding TTN classifiers into QNNs for multiclass classification remains challenging. Key obstacles are the highorder gate operations required for large bond dimensions and the mid-circuit postselection with exponentially low success rates necessary for the exact embedding. In this work, to address these challenges, we propose forest tensor network (FTN)-classifiers, which aggregate multiple small-bond-dimension TTNs. This allows us to handle multiclass classification without requiring large gates in the embedded circuits. We then remove the overhead of mid-circuit postselection by extending the adiabatic encoding framework to our setting and smoothly encode the FTN-classifiers into a quantum forest tensor network (qFTN)- classifiers. Numerical experiments on MNIST and CIFAR-10 demonstrate that we can successfully train FTN-classifiers and encode them into qFTN-classifiers, while maintaining or even improving the performance of the pre-trained FTN-classifiers. These results suggest that synergy between TTN classification models and QNNs can provide a robust and scalable framework for multiclass quantum-enhanced image classification."
Layered semiconductors integrated with polyimide thin films for high-quality valleytronic and quantum-photonic systems,"Jithin T Surendran, Indrajeet D Prasad, Kenji Watanabe, Takashi Taniguchi, Santosh Kumar",2025-04-21,2025,http://arxiv.org/abs/2504.14986v1,"Dielectric integration of layered semiconductors is a prerequisite for fabricating high-quality optoelectronic, valleytronic, and quantum-photonic devices. While hexagonal boron nitride (hBN) is the current benchmark dielectric, exploration of the most suitable dielectric materials covering the complete substrates continues to expand. This work demonstrates the formation of high optical-quality excitons in two widely explored layered semiconductors, WSe$_2$ and WS$_2$, integrated into polyimide (PI) thin films of thicknesses $\approx$500 nm. The photoluminescence (PL) studies at $T$ = 296 K show the formation of neutral excitons $\left(X^0\right)$ and trions in fully-PI-encapsulated 1L-WSe$_2$ with 2-sigma ($2\sigma$) spatial-inhomogeneity of 4.5 (3.4) meV in $X^0$ emission energy (linewidth), which is $\approx$1/3rd (1/5th), respectively, that of inhomogeneity measured in fully-hBN-encapsulated 1L-WSe$_2$. A smaller $2\sigma$ of 2.1 (2.3) meV in $X^0$ emission energy (linewidth) has been shown for fully-PI-encapsulated 1L-WS$_2$. Polarization-resolved and excitation power-dependent PL measurements of PI-isolated 1L-TMDs at $T$ = 4 K further reveal formations of high-quality neutral-biexcitons and negatively-charged biexcitons, with degrees of valley-polarization up to 21$\%$ under non-resonant excitation. Furthermore, the fully-PI-encapsulated 1L-WSe$_2$ also hosts single quantum emitters with narrow linewidths and high-spectral stability. This work indicates that PI thin films may serve the purpose of high-quality dielectric material for integrating the layered materials on a wafer scale."
Nonreciprocal photon blockade induced by parametric amplification in an asymmetrical cavity,"Shao-Xiong Wu, Xue-Chen Gao, Huan-Huan Cheng, Cheng-Hua Bai",2025-04-21,2025,http://arxiv.org/abs/2504.14974v1,"We propose a scheme to generate and manipulate nonreciprocal photon blockade effect in an asymmetrical Fabry-P\'{e}rot cavity, which consists of a single two-level atom and a second-order nonlinear medium. By utilizing the intrinsic spatial asymmetry of cavity and applying a parametric amplification pumping laser to the nonlinear medium, we can realize direction-dependent single-photon and two-photon blockade effects. For nonreciprocal single-photon blockade, our proposal is robust across a wide range of parameters, such as the cavity or atomic detuning, coupling strength, and atomic decay. Within similar parameter ranges, nonreciprocal two-photon blockade can be achieved and modulated by finely adjusting the parametric amplification pumping. Our project offers a feasible access to generating high-quality and tunable nonreciprocal single/two-photon source and paves a new avenue for investigating the nonreciprocity of photon quantum statistical properties."
Advancing quantum process tomography through universal compilation,"Huynh Le Dan Linh, Vu Tuan Hai, Le Bin Ho",2025-04-21,2025,http://arxiv.org/abs/2504.14958v1,"Quantum process tomography (QPT) is crucial for characterizing operations in quantum gates and circuits, however, existing methods face scalability and noise sensitivity challenges. Here, we propose a QPT approach based on universal compilation, which systematically decomposes quantum processes into optimized Kraus operators and Choi matrices. This method utilizes efficient algorithms to improve accuracy while reducing resource requirements. We benchmark our approach through numerical simulations of random unitary gates, demonstrating highly accurate quantum process characterization. Additionally, we apply it to dephasing processes with time-homogeneous and time-inhomogeneous noise, achieving improved fidelity and robustness. Our work further enables broader applications in quantum error correction and device validation."
Parallel Kac's Walk Generates PRU,"Chuhan Lu, Minglong Qin, Fang Song, Penghui Yao, Mingnan Zhao",2025-04-21,2025,http://arxiv.org/abs/2504.14957v1,"Ma and Huang recently proved that the PFC construction, introduced by Metger, Poremba, Sinha and Yuen [MPSY24], gives an adaptive-secure pseudorandom unitary family PRU. Their proof developed a new path recording technique [MH24].   In this work, we show that a linear number of sequential repetitions of the parallel Kac's Walk, introduced by Lu, Qin, Song, Yao and Zhao [LQSY+24], also forms an adaptive-secure PRU, confirming a conjecture therein. Moreover, it additionally satisfies strong security against adversaries making inverse queries. This gives an alternative PRU construction, and provides another instance demonstrating the power of the path recording technique. We also discuss some further simplifications and implications."
Solution of the Klein-Gordon equation in external Yang-Mills gauge field,V. V. Parazian,2025-04-21,2025,http://arxiv.org/abs/2504.14953v1,Exact solutions of the Klein-Gordon equation in an external non-Abelian gauge field with an SU(N) symmetry group have been obtained. The external field is a solution of the Yang-Mills equations and describes a plane wave on the light cone. The obtained solutions form a complete set and can be used in the procedure of canonical quantization of scalar fields.
Erratic non-Hermitian skin localization,Stefano Longhi,2025-04-21,2025,http://arxiv.org/abs/2504.14910v1,"A novel localization phenomenon, termed erratic non-Hermitian skin localization, has been identified in disordered globally-reciprocal non-Hermitian lattices. Unlike conventional non-Hermitian skin effect and Anderson localization, it features macroscopic eigenstate localization at irregular, disorder-dependent positions with sub-exponential decay. Using the Hatano-Nelson model with disordered imaginary gauge fields as a case study, this effect is linked to stochastic interfaces governed by the universal order statistics of random walks. Finite-size scaling analysis confirms the localized nature of the eigenstates. This discovery challenges conventional wave localization paradigms, offering new avenues for understanding and controlling localization phenomena in non-Hermitian physics."
Converting $PT$-Symmetric Topological Classes by Floquet Engineering,"Ming-Jian Gao, Jun-Hong An",2025-04-21,2025,http://arxiv.org/abs/2504.14846v1,"Going beyond the conventional classification rule of Altland-Zirnbauer symmetry classes, $PT$ symmetric topological phases are classified by $(PT)^2=1$ or $-1$. The interconversion between the two $PT$-symmetric topological classes is generally difficult due to the constraint of $(PT)^2$. Here, we propose a scheme to control and interconvert the $PT$-symmetric topological classes by Floquet engineering. We find that it is the breakdown of the $\mathbb{Z}_2$ gauge, induced by the $\pi$ phase difference between different hopping rates, by the periodic driving that leads to such an interconversion. Relaxing the system from the constraint of $(PT)^2$, rich exotic topological phases, e.g., the coexisting $PT$-symmetric first-order real Chern insulator and second-order topological insulators not only in different quasienergy gaps, but also in one single gap, are generated. In contrast to conventional Floquet topological phases, our result provides a way to realize exotic topological phases without changing symmetries. It enriches the family of topological phases and gives an insightful guidance for the development of multifunctional quantum devices."
(Sub)Exponential Quantum Speedup for Optimization,"Jiaqi Leng, Kewen Wu, Xiaodi Wu, Yufan Zheng",2025-04-21,2025,http://arxiv.org/abs/2504.14841v1,"We demonstrate provable (sub)exponential quantum speedups in both discrete and continuous optimization, achieved through simple and natural quantum optimization algorithms, namely the quantum adiabatic algorithm for discrete optimization and quantum Hamiltonian descent for continuous optimization. Our result builds on the Gily\'en--Hastings--Vazirani (sub)exponential oracle separation for adiabatic quantum computing. With a sequence of perturbative reductions, we compile their construction into two standalone objective functions, whose oracles can be directly leveraged by the plain adiabatic evolution and Schr\""odinger operator evolution for discrete and continuous optimization, respectively."
Variational quantum algorithm for the Poisson equation based on the banded Toeplitz systems,"Xiaoqi Liu, Yuedi Qu, Ming Li, Shu-qian Shen",2025-04-21,2025,http://arxiv.org/abs/2504.14828v1,"For solving the Poisson equation it is usually possible to discretize it into solving the corresponding linear system $Ax=b$.Variational quantum algorithms (VQAs) for the discreted Poisson equation have been studied before. We give a VQA based on the banded Toeplitz systems for solving the Poisson equation with respect to the structural features of matrix $A$. In detail, we decompose the matrix $A$ and $A^2$ into a linear combination of the corresponding banded Toeplitz matrix and sparse matrices with only a few non-zero elements. For the one-dimensional Poisson equation with different boundary conditions and the $d$-dimensional Poisson equation with Dirichlet boundary conditions, the number of decomposition terms is less than the work in [Phys. Rev. A 108, 032418 (2023)]. Based on the decomposition of the matrix, we design quantum circuits that evaluate efficiently the cost function.Additionally, numerical simulation verifies the feasibility of the proposed algorithm. In the end, the VQAs for linear systems of equations and matrix-vector multiplications with $K$-banded Teoplitz matrix $T_n^K$ are given, where $T_n^K\in R^{n\times n}$ and $K\in O({\rm ploy}\log n)$."
Categorifying Clifford QCA,Bowen Yang,2025-04-21,2025,http://arxiv.org/abs/2504.14811v1,"We provide a complete classification of Clifford quantum cellular automata (QCAs) on arbitrary metric spaces and any qudits (of prime or composite dimensions) in terms of algebraic L-theory. Building on the delooping formalism of Pedersen and Weibel, we reinterpret Clifford QCAs as symmetric formations in a filtered additive category constructed from the geometry of the underlying space. This perspective allows us to identify the group of stabilized Clifford QCAs, modulo circuits and separated automorphisms, with the Witt group of the corresponding Pedersen--Weibel category. For Euclidean lattices, the classification reproduces and expands upon known results, while for more general spaces -- including open cones over finite simplicial complexes -- we relate nontrivial QCAs to generalized homology theories with coefficients in the L-theory spectrum. We also outline extensions to QCAs with symmetry and mixed qudit dimensions, and discuss how these fit naturally into the L-theoretic framework."
Quantum Measurement Without Collapse or Many Worlds: The Branched Hilbert Subspace Interpretation,Xing M. Wang,2025-04-21,2025,http://arxiv.org/abs/2504.14791v1,"The interpretation of quantum measurements presents a fundamental challenge in quantum mechanics, with concepts such as the Copenhagen Interpretation (CI), Many-Worlds Interpretation (MWI), and Bohmian Mechanics (BM) offering distinct perspectives. We propose the Branched Hilbert Subspace Interpretation (BHSI), which describes measurement as branching the local Hilbert space of a system into parallel subspaces. We formalize the mathematical framework of BHSI using branching and the engaging and disengaging unitary operators to relationally and causally update the states of observers. Unlike the MWI, BHSI avoids the ontological proliferation of worlds and copies of observers, realizing the Born rule based on branch weights. Unlike the CI, BHSI retains the essential features of the MWI: unitary evolution and no wavefunction collapse. Unlike the BM, BHSI does not depend on a nonlocal structure, which may conflict with relativity. We apply BHSI to examples such as the double-slit experiment, the Bell test, Wagner and his friend, and the black hole information paradox. In addition, we explore whether recohering branches can be achieved in BHSI. Compared to the CI and MWI, BHSI provides a minimalist, unitarity-preserving, collapse-free, and probabilistically inherent alternative interpretation of quantum measurements."
Geometric Learning Dynamics,Vitaly Vanchurin,2025-04-20,2025,http://arxiv.org/abs/2504.14728v1,"We present a unified geometric framework for modeling learning dynamics in physical, biological, and machine learning systems. The theory reveals three fundamental regimes, each emerging from the power-law relationship $g \propto \kappa^a$ between the metric tensor $g$ in the space of trainable variables and the noise covariance matrix $\kappa$. The quantum regime corresponds to $a = 1$ and describes Schr\""odinger-like dynamics that emerges from a discrete shift symmetry. The efficient learning regime corresponds to $a = \tfrac{1}{2}$ and describes very fast machine learning algorithms. The equilibration regime corresponds to $a = 0$ and describes classical models of biological evolution. We argue that the emergence of the intermediate regime $a = \tfrac{1}{2}$ is a key mechanism underlying the emergence of biological complexity."
Unconventional Chemical Bonding of Lanthanide-OH Molecules,"Jacek Kłos, Eite Tiesinga, Lan Cheng, Svetlana Kotochigova",2025-04-20,2025,http://arxiv.org/abs/2504.14698v1,"We present a theoretical study of the low lying adiabatic relativistic electronic states of lanthanide monohydroxide (Ln-OH) molecules near their linear equilibrium geometries. We focus on heavy, magnetic DyOH and ErOH relevant to fundamental symmetry tests. We use a restricted-active-space self-consistent field method combined with spin-orbit coupling as well as a relativistic coupled-cluster method. In addition, electric dipole and magnetic moments are computed with the self-consistent field method. Analysis of the results from both methods shows that the dominant molecular configuration of the ground state is one where an electron from the partially filled and submerged 4f orbital of the lanthanide atom moves to the hydroxyl group, leaving the closed outer-most 6s$^2$ lone electron pair of the lanthanide atom intact in sharp contrast to the bonding in alkaline-earth monohydroxides and YbOH, where an electron from the outer-most s shell moves to the hydroxyl group. For linear molecules the projection of the total electron angular momentum on the symmetry axis is a conserved quantity with quantum number $\Omega$ and we study the polynomial $\Omega$ dependence of the energies of the ground states as well as their electric and magnetic moments. We find that the lowest energy states have $|\Omega|=15/2$ and 1/2 for DyOH and ErOH, respectively. The zero field splittings among these $\Omega$ states is approximately $hc\times 1\,000$~cm$^{-1}$. We find that the permanent dipole moments for both triatomics are fairly small at 0.23 atomic units. The magnetic moments are closely related to that of the corresponding atomic Ln$^+$ ion in an excited electronic state. We also realize that the total electron angular momentum is to good approximation conserved and has a quantum number of 15/2 for both triatomic molecules."
Quantum Simulation of the Unruh Temperature the Thermal Properties of Virtually Evolving Bose-Einstein Condensates,"Imad-Eddine Chorfi, Nacer eddine Belaloui, Abdellah Tounsi, Achour Benslama, Mohamed Taha Rouabah",2025-04-20,2025,http://arxiv.org/abs/2504.14685v1,"This paper presents a novel theoretical model to simulate the Unruh temperature by relating it to the critical temperature of multiple Bose-Einstein thermal baths. These thermal baths are conceptualized as snapshots of a Bose-Firework originating from an evolving driven Bose-Einstein condensate (BEC). The critical temperature of each snapshot is determined from the heat capacity, which is numerically estimated by calculating the partition function derived from the system's Hamiltonian. By analyzing the relationship between the average number of the phononic excitations at the critical temperature, acceleration, and the critical temperature itself, our model demonstrates a significant agreement with the Unruh temperature formula, thereby validating our hypothesis. This theoretical approach offers a cost-effective and time-efficient alternative to resource-intensive experimental simulations. Furthermore, it provides a unique perspective on quantum simulation by utilizing the critical phenomena of condensed matter systems to probe fundamental quantum relativistic effects."
Page curve like dynamics in Interacting Quantum Systems,"Tamoghna Ray, Abhishek Dhar, Manas Kulkarni",2025-04-20,2025,http://arxiv.org/abs/2504.14675v1,"We study the dynamics of entanglement in a one-dimensional $XXZ$ spin-$1/2$ chain, with and without integrability-breaking interactions, that is connected to a bath. We start from a state where the system and bath are completely unentangled, and the bath is polarized spin-down. We consider two different initial states for the system - (i) a polarized spin-up state, and (ii) an infinite temperature state. In the particle representation of the spin chain, the polarized spin-up state corresponds to a filled state, while the polarized spin-down state corresponds to an empty state. Starting from these inhomogeneous quenches, in all the above-mentioned cases we obtain the Page curve like behavior in the entanglement. We report different power-law behavior in the growth of entanglement for different initial states and different kinds of baths (interacting and non-interacting). In an attempt to explore plausible deep connections between entanglement and Boltzmann entropy, we investigate the latter in both the filled and the infinite temperature case, for the system and the bath. For the filled case, the Boltzmann entropy of the system has the form of a Page curve but quantitatively deviates from the entanglement. On the other hand, the entropy of the bath keeps increasing. Remarkably, for the infinite temperature case, we find that the system and bath Boltzmann entropies agree with the entanglement entropy, after and before the Page time, respectively. Our findings are expected to hold for generic interacting quantum systems and could be of relevance to black hole physics."
Exact Duality at Low Energy in a Josephson Tunnel Junction Coupled to a Transmission Line,"Luca Giacomelli, Michel H. Devoret, Cristiano Ciuti",2025-04-20,2025,http://arxiv.org/abs/2504.14651v1,"We theoretically explore the low-energy behavior of a Josephson tunnel junction coupled to a finite-length, charge-biased transmission line and compare it to its flux-biased counterpart. For transmission lines of increasing length, we show that the low-energy charge-dependent energy bands of the charge-biased configuration can be exactly mapped onto those of the flux-biased system via a well-defined duality transformation of circuit parameters. In the limit of an infinitely long transmission line, the influence of boundary conditions vanishes, and both circuits reduce to a resistively shunted Josephson junction. This convergence reveals the system's intrinsic self-duality and critical behavior. Our exact formulation of charge-flux duality provides a foundation for generalizations to more complex superconductor-insulator phase transitions."
