Title,Authors,Published,Year,URL,Summary
Multi-Target Rydberg Gates via Spatial Blockade Engineering,"Samuel Stein, Chenxu Liu, Shuwen Kan, Eleanor Crane, Yufei Ding, Ying Mao, Alexander Shuckert, Ang Li",2025-04-21,2025,http://arxiv.org/abs/2504.15282v1,"Multi-target gates offer the potential to reduce gate depth in syndrome extraction for quantum error correction. Although neutral-atom quantum computers have demonstrated native multi-qubit gates, existing approaches that avoid additional control or multiple atomic species have been limited to single-target gates. We propose single-control-multi-target CZ^{\otimes N}) gates on a single-species neutral-atom platform that require no extra control and have gate durations comparable to standard CZ gates. Our approach leverages tailored interatomic distances to create an asymmetric blockade between the control and target atoms. Using a GPU-accelerated pulse synthesis protocol, we design smooth control pulses for CZZ and CZZZ gates, achieving fidelities of up to 99.55% and 99.24%, respectively, even in the presence of simulated atom placement errors and Rydberg-state decay. This work presents a practical path to implementing multi-target gates in neutral-atom systems, significantly reducing the resource overhead for syndrome extraction."
Improved Algorithms for Quantum MaxCut via Partially Entangled Matchings,"Anuj Apte, Eunou Lee, Kunal Marwaha, Ojas Parekh, James Sud",2025-04-21,2025,http://arxiv.org/abs/2504.15276v1,"We introduce a $0.611$-approximation algorithm for Quantum MaxCut and a $\frac{1+\sqrt{5}}{4} \approx 0.809$-approximation algorithm for the EPR Hamiltonian of [arXiv:2209.02589]. A novel ingredient in both of these algorithms is to partially entangle pairs of qubits associated to edges in a matching, while preserving the direction of their single-qubit Bloch vectors. This allows us to interpolate between product states and matching-based states with a tunable parameter."
Realization of maximally-entangling two-qutrit gates using the Cross-Resonance scheme,"Yash Saxena, Sagnik Chatterjee, Tharrmashastha Sapv",2025-04-21,2025,http://arxiv.org/abs/2504.15265v1,"Three-level systems have natural advantages over their two-level counterparts in quantum information and computation. Although generally used for qubits, the existing superconducting transmon architecture can naturally be extended to three levels, which allows the exploration of the entire qutrit Hilbert space. Realizing a maximally entangling two-qutrit gate is necessary for universal quantum computation using three-level systems. Our work extends the state-of-the-art approach by providing a theoretical framework for realizing a high-fidelity two-qutrit generalized CR gate using the cross-resonance framework. Using our framework, we experimentally demonstrate two-qutrit generalized controlled-$\sqrt{X}$ gates through simulations on QISKIT dynamics, which in turn allow us to obtain a maximum extracted concurrence of $97.2\pm0.1\%$, thereby demonstrating that entanglement has been achieved on all three levels. Using the above gates, we also prepare a two-qutrit Bell state with a fidelity of $96.9\pm 0.1\%$."
Sunflowers and Ramsey problems for restricted intersections,"Barnabás Janzer, Zhihan Jin, Benny Sudakov, Kewen Wu",2025-04-21,2025,http://arxiv.org/abs/2504.15264v1,"Extremal problems on set systems with restricted intersections have been an important part of combinatorics in the last 70 year. In this paper, we study the following Ramsey version of these problems. Given a set $L\subseteq \{0,\dots,k-1\}$ and a family $\mathcal{F}$ of $k$-element sets which does not contain a sunflower with $m$ petals whose kernel size is in $L$, how large a subfamily of $\mathcal{F}$ can we find in which no pair has intersection size in $L$? We give matching upper and lower bounds, determining the dependence on $m$ for all $k$ and $L$. This problem also finds applications in quantum computing.   As an application of our techniques, we also obtain a variant of F\""uredi's celebrated semilattice lemma, which is a key tool in the powerful delta-system method. We prove that one cannot remove the double-exponential dependency on the uniformity in F\""uredi's result, however, we provide an alternative with significantly better, single-exponential dependency on the parameters, which is still strong enough for most applications of the delta-system method."
Broadband Fourier transform spectroscopy of quantum emitters photoluminescence with sub-nanosecond temporal resolution,"Issam Belgacem, Pasquale Cilibrizzi, Muhammad Junaid Arshad, Daniel White, Malte Kroj, Christiaan Bekker, Margherita Mazzera, Brian D. Gerardot, Angelo C. Frangeskou, Gavin W. Morley, Nguyen Tien Son, Jawad Ul-Hassan, Takeshi Ohshima, Hiroshi Abe, Lorenzo Vinco, Dario Polli, Giulio Cerullo, Cristian Bonato",2025-04-21,2025,http://arxiv.org/abs/2504.15258v1,"The spectral characterization of quantum emitter luminescence over broad wavelength ranges and fast timescales is important for applications ranging from biophysics to quantum technologies. Here we present the application of time-domain Fourier transform spectroscopy, based on a compact and stable birefringent interferometer coupled to low-dark-count superconducting single-photon detectors, to the study of quantum emitters. We experimentally demonstrate that the system enables spectroscopy of quantum emitters over a broad wavelength interval from the near-infrared to the telecom range, where grating-based spectrometers coupled to InGaAs cameras are typically noisy and inefficient. We further show that the high temporal resolution of single-photon detectors, which can be on the order of tens of picoseconds, enables the monitoring of spin-dependent spectral changes on sub-nanosecond timescales."
Quantum-enhanced second harmonic generation beyond the photon pairs regime,"Thomas Dickinson, Ivi Afxenti, Giedre Astrauskaite, Lennart Hirsch, Samuel Nerenberg, Ottavia Jedrkiewicz, Daniele Faccio, Caroline Müllenbroich, Alessandra Gatti, Matteo Clerici, Lucia Caspani",2025-04-21,2025,http://arxiv.org/abs/2504.15249v1,"Two-photon processes are crucial in applications like microscopy and microfabrication, but their low cross-section requires intense illumination and limits, e.g., the penetration depth in nonlinear microscopy. Entangled states have been proposed to enhance the efficiency of two-photon interactions and have shown effectiveness at low intensities. This quantum enhancement is generally believed to be lost at high intensities, for more than one photon per mode, raising doubts about its usefulness. We explored experimentally and theoretically two-photon processes driven by entangled photons at intensities beyond this threshold and compared the results with the classical case. We found that a quantum advantage can still be observed at nearly one order of magnitude higher intensities than previously assumed. Our findings show a potential path for exploiting quantum-enhanced two-photon processes in practical applications."
Rydberg Atoms in a Ladder Geometry: Quench Dynamics and Floquet Engineering,"Mainak Pal, Tista Banerjee",2025-04-21,2025,http://arxiv.org/abs/2504.15230v1,"In recent days, Rydberg atom quantum simulator platforms have emerged as novel quantum simulators for physical systems ranging from condensed matter to particle physics. On a fundamental level, these platforms allow for a direct test of our understanding of the emergence of quantum statistical mechanics starting from the laws of quantum dynamics. In this paper, we investigate the fate of quantum dynamics in a model of Rydberg atoms arranged in a square ladder geometry, with a Rabi frequency $2\Omega$ and a detuning profile which is staggered along the longer direction with amplitude $\Delta$. As the staggering strength $\Delta$ is tuned from $\Delta/\Omega=0\rightarrow\infty$, the model exhibits a wide class of dynamical phenomena, ranging from (i) quantum many-body scars (QMBS) ($\Delta/\Omega \sim 0,1$), (ii) integrability induced slow dynamics and approximate Krylov fractures ($\Delta/\Omega \gg 1$) . Additionally, by leveraging the underlying chiral nature of the spectrum of this model Hamiltonian, it is possible to design Floquet protocols leading to dynamical signatures reminiscent of discrete time-crystalline order and exact Floquet flat bands. Finally, we study the robustness of these dynamical features against imperfections in the implementation of the Floquet protocols, long-range van der Waals interactions and inevitable influences from the environment in the form of pure dephasing and the finite lifetime of the Rydberg excited state."
Fine features of entanglement dynamics in quenches across the Ising quantum critical point,Aditya Banerjee,2025-04-21,2025,http://arxiv.org/abs/2504.15203v1,"The task of exploring and understanding important aspects of far-from-equilibrium dynamics of closed and generic quantum many-body systems has received a thrust of attention in recent years, driven partly by remarkable advances in ultracold experimental technologies. In this work, for the paradigmatic Ising spin chain with transverse and longitudinal fields, we present numerical observations of several ""fine-grained"" features of far-from-equilibrium dynamics, induced by quantum quenches across the Ising critical point, from a quantum informational point of view that have hitherto escaped notice. Rather featureless dynamics is seen for ferromagnetic to paramagnetic quenches, but paramagnetic to ferromagnetic quenches exhibit rich behaviour, including a series of sudden deaths and revivals of entanglement between two spins in the system's bulk, periodic but short-lived occurrences of approximately $1-$uniform states, non-analytic cusps in single-copy entanglement entropy for sufficiently big subsystems, insufficient mixedness and a series of scrambling-$\textit{un}$scrambling of local information between neighboring spins. Moreover, essentially indistinguishable dynamics is seen at very early times between the integrable limit (zero longitudinal field) and non-integrable cases, with the former eventually showing signatures of better mixing and faster approach to equilibration than the latter. These features are expected to hold for quench dynamics across Ising quantum critical points in more complicated systems."
Quantum phase discrimination with applications to quantum search on graphs,"Guanzhong Li, Lvzhou Li, Jingquan Luo",2025-04-21,2025,http://arxiv.org/abs/2504.15194v1,"We study the phase discrimination problem, in which we want to decide whether the eigenphase $\theta\in(-\pi,\pi]$ of a given eigenstate $|\psi\rangle$ with eigenvalue $e^{i\theta}$ is zero or not, using applications of the unitary $U$ provided as a black box oracle.We propose a quantum algorithm named {\it quantum phase discrimination(QPD)} for this task, with optimal query complexity $\Theta(\frac{1}{\lambda}\log\frac{1}{\delta})$ to the oracle $U$, where $\lambda$ is the gap between zero and non-zero eigenphases and $\delta$ the allowed one-sided error. The quantum circuit is simple, consisting of only one ancillary qubit and a sequence of controlled-$U$ interleaved with single qubit $Y$ rotations, whose angles are given by a simple analytical formula. Quantum phase discrimination could become a fundamental subroutine in other quantum algorithms, as we present two applications to quantum search on graphs:   i) Spatial search on graphs. Inspired by the structure of QPD, we propose a new quantum walk model, and based on them we tackle the spatial search problem, obtaining a novel quantum search algorithm. For any graph with any number of marked vertices, the quantum algorithm that can find a marked vertex with probability $\Omega(1)$ in total evolution time $ O(\frac{1}{\lambda \sqrt{\varepsilon}})$ and query complexity $ O(\frac{1}{\sqrt{\varepsilon}})$, where $\lambda$ is the gap between the zero and non-zero eigenvalues of the graph Laplacian and $\varepsilon$ is a lower bound on the proportion of marked vertices.   ii) Path-finding on graphs.} By using QPD, we reduce the query complexity of a path-finding algorithm proposed by Li and Zur [arxiv: 2311.07372] from $\tilde{O}(n^{11})$ to $\tilde{O}(n^8)$, in a welded-tree circuit graph with $\Theta(n2^n)$ vertices.   Besides these two applications, we argue that more quantum algorithms might benefit from QPD."
Method for simulating open-system dynamics using mid-circuit measurements on a quantum computer,"John P. T. Stenger, Gloria Bazargan, Nicholas T. Bronn, Daniel Gunlycke",2025-04-21,2025,http://arxiv.org/abs/2504.15187v1,"We present a method for simulating the dynamics of an open electronic system on a quantum computer. This approach entails mid-circuit measurements and resets to simulate the addition or removal of fermions from the system and provides a way to apply non-reversible operations to a quantum computer. Using this method, we simulate the dynamics of an open electronic system consisting of a fermionic chain positioned between two conductive leads on the $ibm\_torino$ quantum computer."
Multiple Quantum Many-Body Clustering Probed by Dynamical Decoupling,"Gerónimo Sequeiros, Claudia M. Sánchez, Lisandro Buljubasich, Ana K. Chattah, Horacio M. Pastawski, Rodolfo H. Acosta",2025-04-21,2025,http://arxiv.org/abs/2504.15183v1,"The manipulation of quantum information in large systems requires precise control of quantum systems that are out-of-equilibrium. As the size of the system increases, its fragility in response to external perturbations and intrinsic decoherence processes also increases. The degradation of the system response makes accurate measurements a challenging and time-consuming task. However, quantum information lifetime enhancement can be achieved by dynamical decoupling techniques (DD), where an external drive with a frequency much higher than the system's internal evolution renders signal acquisition with decay times greater than 1000-fold. In this study, we demonstrate that the system response during a prethermal period, subject to Floquet control, can be utilized to probe the multiple quantum evolution of dense and highly connected spin systems. This approach exhibits an enhanced sensitivity at a reduced experimental time. The enhanced signal-to-noise ratio achieved enabled the use of numerical inversion strategies to model the evolution of the excited multiple quantum coherences, which describe the number of correlated spins within a cluster. We observed for the first time, to the best of our knowledge, that the increase in the number of correlated spins with multiple quantum evolution is accompanied by an increase in the distribution of spin cluster sizes, which follows a quadratic law."
Geometric speed limit of state preparation and curved control spaces,"Maximilian Goll, Robert H. Jonsson",2025-04-21,2025,http://arxiv.org/abs/2504.15175v1,"The preparation of quantum many-body systems faces the difficulty that in a realistic scenario only few control parameters of the system may be accessible. In this context, an interesting connection between the energy fluctuations during state preparation and its geometric length as measured by the Fubini-Study metric was discussed in Bukov et al., ""Geometric Speed Limit of Accessible Many-Body State Preparation"", Phys. Rev. X 9, 011034 (2019). An inspiring conjecture was put forward lower bounding the energy fluctuations by the minimal geometric length of all accessible state preparation protocols. We here show that the conjecture holds if the accessible parameter space has no extrinsic curvature, when embedded into the space of all dynamically accessible states. If the parameter space has extrinsic curvature a weakened version of the conjecture applies. We discuss instructive examples for a qubit system and harmonic oscillators."
Quantum Excitation Transfer in an Artificial Photosynthetic Light-Harvesting System,"Stephon Alexander, Roger Andrews, Oliver Fox, Sarben Sarkar",2025-04-21,2025,http://arxiv.org/abs/2504.15172v1,"We analytically derive transfer probabilities and efficiencies for an artificial light-harvesting photosynthetic system, which consists of a ring coupled to a central acceptor. For an incident photon pair, we find near-perfect single excitation transfer efficiency with negligible double excitation transfer in the weak coupling regime. In the strong coupling regime, single excitation transfer efficiency was greater than 90%, while the double excitation efficiency was approximately 50%. We have found that the three main factors which determine high transfer efficiencies are large acceptor probabilities, long acceptor decay times, and strong photon-ring coupling. A possible implementation of the theoretical framework to bio-inspired solar energy devices is also discussed."
Non-Hermitian Hopf insulators,"Daichi Nakamura, Kohei Kawabata",2025-04-21,2025,http://arxiv.org/abs/2504.15154v1,"Hopf insulators represent a unique class of topological insulators that exist exclusively in two-band systems and are inherently unstable upon the inclusion of additional bands. Meanwhile, recent studies have shown that non-Hermiticity gives rise to distinctive complex-energy gap structures, known as point gaps, and associated topological phases with no analogs in Hermitian systems. However, non-Hermitian counterparts of Hopf insulators have remained largely elusive. Here, we generally classify topological phases of two-band non-Hermitian systems based on the homotopy theory and uncover Hopf-type point-gap topology present only for two bands. Specifically, we reveal such Hopf-type point-gap topology for three-dimensional systems with chiral symmetry (class AIII) and four-dimensional systems with no symmetry (class A). Explicitly constructing prototypical models from the Hermitian Hopf insulator, we further demonstrate that these non-Hermitian topological phases lead to anomalous point-gapless boundary states spectrally detachable from the bulk bands."
Breaking Down Quantum Compilation: Profiling and Identifying Costly Passes,"Felix Zilk, Alessandro Tundo, Vincenzo De Maio, Ivona Brandic",2025-04-21,2025,http://arxiv.org/abs/2504.15141v1,"With the increasing capabilities of quantum systems, the efficient, practical execution of quantum programs is becoming more critical. Each execution includes compilation time, which accounts for substantial overhead of the overall program runtime. To address this challenge, proposals that leverage precompilation techniques have emerged, whereby entire circuits or select components are precompiled to mitigate the compilation time spent during execution. Considering the impact of compilation time on quantum program execution, identifying the contribution of each individual compilation task to the execution time is necessary in directing the community's research efforts towards the development of an efficient compilation and execution pipeline. In this work, we perform a preliminary analysis of the quantum circuit compilation process in Qiskit, examining the cumulative runtime of each individual compilation task and identifying the tasks that most strongly impact the overall compilation time. Our results indicate that, as the desired level of optimization increases, circuit optimization and gate synthesis passes become the dominant tasks in compiling a Quantum Fourier Transform, with individual passes consuming up to 87% of the total compilation time. Mapping passes require the most compilation time for a GHZ state preparation circuit, accounting for over 99% of total compilation time."
Fully connected twin-field quantum key distribution network,"Chunfeng Huang, Rui Guan, Xin Liu, Shizhuo Li, Wenjie He, Hao Liang, Ziyang Luo, Zhenrong Zhang, Wei Li, Kejin Wei",2025-04-21,2025,http://arxiv.org/abs/2504.15137v1,"Quantum key distribution (QKD) is a key application in quantum communication, enabling secure key exchange between parties using quantum states. Twin-field (TF) QKD offers a promising solution that surpasses the repeaterless limits, and its measurement-device-independent nature makes it suitable for star-type network architectures. In this work, we propose and demonstrate a fully connected TF-QKD network architecture, where users prepare quantum signals and send them to network nodes. These nodes use splitters to route the signals to measurement units, enabling secure key distribution among arbitrary users. A proof-of-principle demonstration with three users successfully achieved secure key sharing over simulated link losses of up to 30 dB, with an average rate of $5.01 \times 10^{-7}$ bit per pulse. Additionally, simulations show that the architecture can support up to $32$ users with a secure key rate of 280.90 bits/s under typical fiber loss conditions. This approach represents a significant advancement in the topology of untrusted-node QKD networks and holds promise for practical, large-scale applications in secure communication."
Efficient simulation of Clifford circuits with small Markovian errors,"Ashe Miller, Corey Ostrove, Jordan Hines, Robin Blume-Kohout, Kevin Young, Timothy Proctor",2025-04-21,2025,http://arxiv.org/abs/2504.15128v1,"Classical simulation of noisy quantum circuits is essential for understanding quantum computing experiments. It enables scalable error characterization, analysis of how noise impacts quantum algorithms, and optimized implementations of quantum error correction. However, most existing efficient simulation techniques can only simulate the effects of stochastic (incoherent) noise. The lack of efficient ways to simulate coherent errors, which are common and significant in contemporary quantum computing systems, has frustrated research. We remedy this gap by introducing an efficient algorithm for approximate simulation of Clifford circuits with arbitrary small errors (including coherent errors) that can be described by sparse $n$-qubit Lindbladians. We use this algorithm to study the impact of coherent errors on syndrome extract circuits for distance-3, 5, 7, 9, and 11 rotated surface codes, and on deep random 225-qubit circuits containing over a million gates."
Squeezing Effect in the Gouy Phase of Matter Waves,"Thiago M. S. Oliveira, Lucas S. Marinho, F. C. V. de Brito, Marcos Sampaio, Irismar G. da Paz",2025-04-21,2025,http://arxiv.org/abs/2504.15123v1,"We investigate the Gouy phase emerging from the time evolution of confined matter waves in a harmonic potential. Specifically, we analyze the quantum dynamics of a Gaussian wavepacket that exhibits position--momentum correlations. By tuning the parameters governing its evolution, we reveal intriguing effects, with a particular focus on squeezing. Notably, during the wavepacket evolution quantum spreading and squeezing processes emerge, giving rise to Gouy phase contributions of $\pi/4$ rad, establishing a clear link between the Gouy phase and a purely quantum phenomenon. Furthermore, the interplay between wavepacket squeezing and one-dimensional spreading leads to a total Gouy phase accumulation of $\pi/2$ rad in an oscillation period. Both squeezing and Gouy phase have individually proven valuable in state engineering and quantum metrology. By demonstrating a direct, controllable relationship between these two fundamental processes, our findings expand the realm of quantum-enhanced technologies, including quantum sensing and precision measurement."
Sensing with Quantum Light: A perspective,Animesh Datta,2025-04-21,2025,http://arxiv.org/abs/2504.15114v1,"I present my perspective on sensing with quantum light. I summarise the motivations and methodology for identifying quantum enhancements in sensing over a classical sensor. In the real world, this enhancement will be a constant factor, and not increase with the size of the quantum probe as is often advertised. I use a limited survey of interferometry, microscopy, and spectroscopy to extract the vital challenges that must be faced to realise tangible enhancements in sensing with quantum light."
Wireless energy transfer in non-Hermitian quantum battery,"Fang-Mei Yang, Fu-Quan Dou",2025-04-21,2025,http://arxiv.org/abs/2504.15091v1,"The extraction of energy is one of fundamental challenges in realizing quantum batteries (QBs). Here, we propose two wireless transfer schemes with parity-time symmetries to efficiently extract the energy stored in non-Hermitian QBs to consumption centers. For linear cases, the transfer energy oscillates periodically in the unbroken symmetry region and grows hyperbolically in the broken region. For nonlinear cases, the transfer energy eventually reach and remain steady-state values arising from the feedback mechanism of the nonlinear saturable gain. Furthermore, we show the significant robustness and the ultrafast response of the wireless transfer schemes to sudden movements around one metre. Our work overcomes energy bottlenecks for wireless transfer schemes in QBs and may provide inspirations for practical applications of QBs."
